{
  "schemaVersion": 1,
  "id": "queryengine.payloadbuilder",
  "name": "Payloadbuilder Query Engine",
  "version": "0.1.0",
  "description": "Payloadbuilder query execution runtime.",
  "dependencies": ["queryengine.jdbc"],
  "providesCapabilities": ["queryengine.execute", "queryengine.invoke", "queryengine.payloadbuilder.catalog"],
  "requiredCapabilities": [],
  "backend": {
    "entrypointClass": "com.queryeer.backend.plugin.payloadbuilder.PayloadbuilderBackendPlugin",
    "classpath": {
      "root": "../../../queryeer-backend/backend-plugin-payloadbuilder",
      "include": ["target/classes", "@target/queryeer-plugin-deps.txt"]
    }
  }
}
