{
  "schemaVersion": 1,
  "id": "queryengine.jdbc.dialect.postgres",
  "name": "PostgreSQL JDBC Dialect",
  "version": "0.1.0",
  "description": "PostgreSQL dialect runtime contribution.",
  "dependencies": ["queryengine.jdbc"],
  "providesCapabilities": ["queryengine.jdbc.dialect.postgres"],
  "requiredCapabilities": ["queryengine.jdbc.connection"],
  "backend": {
    "entrypointClass": "com.queryeer.backend.plugin.jdbc.postgres.PostgresBackendPlugin",
    "classpath": {
      "root": "../../../queryeer-backend/backend-plugin-dialect-postgres",
      "include": ["target/classes", "@target/queryeer-plugin-deps.txt"]
    }
  }
}
